{
  "$schema": "http://json-schema.org/draft-07/schema#",
  "$id": "https://chameleonjp-lab.github.io/chameleonassetstudio/schema/asset.schema.json",
  "title": "Chameleon Asset",
  "description": "ゲームに組み込む 1 つの素材（asset.json）。未対応の追加プロパティは検証エラーにせず保持する。",
  "type": "object",
  "required": [
    "format",
    "version",
    "id",
    "assetType",
    "name",
    "displayName",
    "canvasSize",
    "origin",
    "textures",
    "layers",
    "parts",
    "anchors",
    "colliders",
    "animations",
    "tags",
    "gameAttributes",
    "createdAt",
    "updatedAt"
  ],
  "properties": {
    "format": {
      "const": "chameleon-asset"
    },
    "version": {
      "const": "0.2.0"
    },
    "id": {
      "type": "string",
      "minLength": 1
    },
    "assetType": {
      "enum": ["character", "item", "background", "tile", "gimmick", "effect"]
    },
    "name": {
      "type": "string",
      "minLength": 1
    },
    "displayName": {
      "type": "string"
    },
    "canvasSize": {
      "$ref": "#/definitions/size"
    },
    "origin": {
      "$ref": "#/definitions/vec2"
    },
    "textures": {
      "type": "array",
      "items": {
        "$ref": "#/definitions/texture"
      }
    },
    "layers": {
      "type": "array",
      "items": {
        "$ref": "#/definitions/layer"
      }
    },
    "parts": {
      "type": "array",
      "items": {
        "$ref": "#/definitions/part"
      }
    },
    "anchors": {
      "type": "array",
      "items": {
        "$ref": "#/definitions/anchor"
      }
    },
    "colliders": {
      "type": "array",
      "items": {
        "$ref": "#/definitions/collider"
      }
    },
    "frames": {
      "type": "array",
      "items": {
        "$ref": "#/definitions/frame"
      }
    },
    "animations": {
      "type": "array",
      "items": {
        "$ref": "#/definitions/animation"
      }
    },
    "tags": {
      "type": "array",
      "items": {
        "type": "string"
      }
    },
    "gameAttributes": {
      "type": "object"
    },
    "provenance": {
      "type": "array",
      "items": {
        "$ref": "#/definitions/provenanceRecord"
      }
    },
    "tile": {
      "$ref": "#/definitions/tileSettings"
    },
    "gimmick": {
      "$ref": "#/definitions/gimmickSettings"
    },
    "effect": {
      "$ref": "#/definitions/effectSettings"
    },
    "rigAnimations": {
      "type": "array",
      "items": {
        "$ref": "#/definitions/rigAnimation"
      }
    },
    "createdAt": {
      "type": "string",
      "format": "date-time"
    },
    "updatedAt": {
      "type": "string",
      "format": "date-time"
    }
  },
  "definitions": {
    "provenanceRecord": {
      "anyOf": [
        {
          "type": "object",
          "required": ["sourceFileName", "mimeType", "byteLength", "hash", "importedAt"],
          "properties": {
            "sourceFileName": {
              "type": "string"
            },
            "mimeType": {
              "type": "string",
              "minLength": 1
            },
            "byteLength": {
              "type": "integer",
              "minimum": 0
            },
            "hash": {
              "type": "string",
              "pattern": "^sha256:[0-9a-f]{64}$"
            },
            "importedAt": {
              "type": "string",
              "format": "date-time"
            },
            "textureId": {
              "type": "string",
              "minLength": 1
            },
            "origin": {
              "type": "string"
            },
            "license": {
              "type": "string"
            }
          },
          "additionalProperties": true
        },
        {
          "type": "object",
          "not": {
            "required": ["sourceFileName"]
          },
          "additionalProperties": true
        }
      ]
    },
    "vec2": {
      "type": "object",
      "required": ["x", "y"],
      "properties": {
        "x": {
          "type": "number"
        },
        "y": {
          "type": "number"
        }
      }
    },
    "size": {
      "type": "object",
      "required": ["width", "height"],
      "properties": {
        "width": {
          "type": "number",
          "exclusiveMinimum": 0
        },
        "height": {
          "type": "number",
          "exclusiveMinimum": 0
        }
      }
    },
    "transform": {
      "type": "object",
      "required": ["position", "scale", "rotation"],
      "properties": {
        "position": {
          "$ref": "#/definitions/vec2"
        },
        "scale": {
          "$ref": "#/definitions/vec2"
        },
        "rotation": {
          "type": "number"
        }
      }
    },
    "texture": {
      "type": "object",
      "required": ["id", "kind", "name", "mimeType", "size", "path"],
      "properties": {
        "id": {
          "type": "string",
          "minLength": 1
        },
        "kind": {
          "enum": ["source", "edit", "thumbnail"]
        },
        "name": {
          "type": "string"
        },
        "mimeType": {
          "enum": ["image/png", "image/webp", "image/jpeg", "image/svg+xml", "image/gif"]
        },
        "size": {
          "$ref": "#/definitions/size"
        },
        "path": {
          "type": "string",
          "minLength": 1
        }
      },
      "allOf": [
        {
          "if": {
            "properties": {
              "kind": {
                "enum": ["edit", "thumbnail"]
              }
            },
            "required": ["kind"]
          },
          "then": {
            "properties": {
              "mimeType": {
                "enum": ["image/png", "image/webp", "image/jpeg"]
              }
            }
          }
        }
      ]
    },
    "layer": {
      "type": "object",
      "required": ["id", "name", "layerType", "visible", "locked", "opacity", "transform"],
      "properties": {
        "id": {
          "type": "string",
          "minLength": 1
        },
        "name": {
          "type": "string"
        },
        "layerType": {
          "enum": ["image", "shape", "guide"]
        },
        "visible": {
          "type": "boolean"
        },
        "locked": {
          "type": "boolean"
        },
        "opacity": {
          "type": "number",
          "minimum": 0,
          "maximum": 1
        },
        "transform": {
          "$ref": "#/definitions/transform"
        },
        "textureId": {
          "type": "string",
          "minLength": 1
        },
        "background": {
          "$ref": "#/definitions/backgroundLayerSettings"
        }
      },
      "if": {
        "properties": {
          "layerType": {
            "const": "image"
          }
        }
      },
      "then": {
        "required": ["textureId"]
      }
    },
    "part": {
      "type": "object",
      "required": ["id", "name", "partType", "layerIds"],
      "properties": {
        "id": {
          "type": "string",
          "minLength": 1
        },
        "name": {
          "type": "string"
        },
        "partType": {
          "enum": [
            "head",
            "body",
            "arm_left",
            "arm_right",
            "leg_left",
            "leg_right",
            "weapon",
            "eye",
            "mouth",
            "shadow",
            "accessory",
            "other"
          ]
        },
        "layerIds": {
          "type": "array",
          "items": {
            "type": "string",
            "minLength": 1
          }
        },
        "pivot": {
          "$ref": "#/definitions/vec2"
        },
        "parentId": {
          "type": "string",
          "minLength": 1
        },
        "bindPose": {
          "$ref": "#/definitions/partPose"
        },
        "rotationLimit": {
          "type": "object",
          "required": ["min", "max"],
          "properties": {
            "min": {
              "type": "number"
            },
            "max": {
              "type": "number"
            }
          }
        }
      }
    },
    "anchor": {
      "type": "object",
      "required": ["id", "name", "role", "position"],
      "properties": {
        "id": {
          "type": "string",
          "minLength": 1
        },
        "name": {
          "type": "string"
        },
        "role": {
          "enum": [
            "foot",
            "center",
            "head",
            "hand_left",
            "hand_right",
            "weapon",
            "projectile_spawn",
            "damage_effect",
            "shadow_center",
            "custom"
          ]
        },
        "position": {
          "$ref": "#/definitions/vec2"
        }
      }
    },
    "collider": {
      "type": "object",
      "required": ["id", "name", "purpose", "shape", "visible"],
      "properties": {
        "id": {
          "type": "string",
          "minLength": 1
        },
        "name": {
          "type": "string"
        },
        "purpose": {
          "enum": ["body", "attack", "pickup", "sensor", "custom"]
        },
        "shape": {
          "enum": ["rect", "circle"]
        },
        "visible": {
          "type": "boolean"
        },
        "rect": {
          "type": "object",
          "required": ["x", "y", "width", "height"],
          "properties": {
            "x": {
              "type": "number"
            },
            "y": {
              "type": "number"
            },
            "width": {
              "type": "number",
              "exclusiveMinimum": 0
            },
            "height": {
              "type": "number",
              "exclusiveMinimum": 0
            }
          }
        },
        "circle": {
          "type": "object",
          "required": ["x", "y", "radius"],
          "properties": {
            "x": {
              "type": "number"
            },
            "y": {
              "type": "number"
            },
            "radius": {
              "type": "number",
              "exclusiveMinimum": 0
            }
          }
        }
      },
      "allOf": [
        {
          "if": {
            "properties": {
              "shape": {
                "const": "rect"
              }
            }
          },
          "then": {
            "required": ["rect"]
          }
        },
        {
          "if": {
            "properties": {
              "shape": {
                "const": "circle"
              }
            }
          },
          "then": {
            "required": ["circle"]
          }
        }
      ]
    },
    "frameLayerState": {
      "type": "object",
      "required": ["layerId"],
      "properties": {
        "layerId": {
          "type": "string",
          "minLength": 1
        },
        "visible": {
          "type": "boolean"
        },
        "transform": {
          "$ref": "#/definitions/transform"
        },
        "opacity": {
          "type": "number",
          "minimum": 0,
          "maximum": 1
        }
      }
    },
    "frameColliderRect": {
      "type": "object",
      "required": ["x", "y", "width", "height"],
      "properties": {
        "x": { "type": "number" },
        "y": { "type": "number" },
        "width": { "type": "number", "exclusiveMinimum": 0 },
        "height": { "type": "number", "exclusiveMinimum": 0 }
      }
    },
    "frameColliderCircle": {
      "type": "object",
      "required": ["x", "y", "radius"],
      "properties": {
        "x": { "type": "number" },
        "y": { "type": "number" },
        "radius": { "type": "number", "exclusiveMinimum": 0 }
      }
    },
    "frameColliderOverride": {
      "type": "object",
      "required": ["colliderId"],
      "properties": {
        "colliderId": { "type": "string", "minLength": 1 },
        "rect": { "$ref": "#/definitions/frameColliderRect" },
        "circle": { "$ref": "#/definitions/frameColliderCircle" },
        "visible": { "type": "boolean" }
      },
      "oneOf": [
        { "required": ["rect"], "not": { "required": ["circle"] } },
        { "required": ["circle"], "not": { "required": ["rect"] } },
        {
          "required": ["visible"],
          "not": { "anyOf": [{ "required": ["rect"] }, { "required": ["circle"] }] }
        }
      ]
    },
    "frame": {
      "type": "object",
      "required": ["id", "name", "layerStates"],
      "properties": {
        "id": {
          "type": "string",
          "minLength": 1
        },
        "name": {
          "type": "string"
        },
        "durationMs": {
          "type": "number",
          "exclusiveMinimum": 0
        },
        "layerStates": {
          "type": "array",
          "items": {
            "$ref": "#/definitions/frameLayerState"
          }
        },
        "colliderOverrides": {
          "type": "array",
          "items": { "$ref": "#/definitions/frameColliderOverride" }
        }
      }
    },
    "animation": {
      "type": "object",
      "required": ["id", "name", "fps", "loop", "frameIds"],
      "properties": {
        "id": {
          "type": "string",
          "minLength": 1
        },
        "name": {
          "type": "string",
          "minLength": 1
        },
        "fps": {
          "type": "number",
          "exclusiveMinimum": 0,
          "maximum": 240
        },
        "loop": {
          "type": "boolean"
        },
        "frameIds": {
          "type": "array",
          "items": {
            "type": "string",
            "minLength": 1
          }
        },
        "durationMs": {
          "type": "number",
          "minimum": 0
        },
        "events": {
          "type": "array",
          "items": {
            "$ref": "#/definitions/animationEvent"
          }
        }
      }
    },
    "eventPrimitive": {
      "oneOf": [
        {
          "type": "string"
        },
        {
          "type": "number"
        },
        {
          "type": "boolean"
        },
        {
          "type": "null"
        }
      ]
    },
    "eventPayload": {
      "oneOf": [
        {
          "$ref": "#/definitions/eventPrimitive"
        },
        {
          "type": "array",
          "items": {
            "$ref": "#/definitions/eventPrimitive"
          }
        },
        {
          "type": "object",
          "additionalProperties": {
            "$ref": "#/definitions/eventPrimitive"
          }
        }
      ]
    },
    "animationEvent": {
      "type": "object",
      "required": ["id", "name", "frameId"],
      "properties": {
        "id": {
          "type": "string",
          "minLength": 1
        },
        "name": {
          "type": "string",
          "minLength": 1
        },
        "frameId": {
          "type": "string",
          "minLength": 1
        },
        "payload": {
          "$ref": "#/definitions/eventPayload"
        }
      }
    },
    "backgroundLayerSettings": {
      "type": "object",
      "required": ["role", "parallaxSpeed", "loopX", "loopY"],
      "properties": {
        "role": {
          "enum": ["far", "mid", "near", "foreground"]
        },
        "parallaxSpeed": {
          "$ref": "#/definitions/vec2"
        },
        "loopX": {
          "type": "boolean"
        },
        "loopY": {
          "type": "boolean"
        }
      }
    },
    "tileSettings": {
      "type": "object",
      "required": ["tileSize", "collisionType", "visualType"],
      "properties": {
        "tileSize": {
          "$ref": "#/definitions/size"
        },
        "collisionType": {
          "enum": ["none", "solid", "one_way", "hazard", "custom"]
        },
        "visualType": {
          "type": "string"
        }
      }
    },
    "gimmickSettings": {
      "type": "object",
      "required": ["movementPreset"],
      "properties": {
        "movementPreset": {
          "type": "string"
        }
      }
    },
    "effectSettings": {
      "type": "object",
      "required": ["effectType", "durationMs", "loop", "blendMode"],
      "properties": {
        "effectType": {
          "enum": ["spark", "hit", "explosion", "aura", "trail", "custom"]
        },
        "durationMs": {
          "type": "number",
          "minimum": 1
        },
        "loop": {
          "type": "boolean"
        },
        "blendMode": {
          "enum": ["normal", "add", "screen"]
        }
      }
    },
    "partPose": {
      "type": "object",
      "properties": {
        "localPosition": {
          "$ref": "#/definitions/vec2"
        },
        "localRotation": {
          "type": "number"
        },
        "localScale": {
          "$ref": "#/definitions/vec2"
        }
      }
    },
    "rigKeyframe": {
      "type": "object",
      "required": ["time", "poses"],
      "properties": {
        "time": {
          "type": "number",
          "minimum": 0,
          "maximum": 1
        },
        "poses": {
          "type": "object",
          "additionalProperties": {
            "$ref": "#/definitions/partPose"
          }
        }
      }
    },
    "rigAnimation": {
      "type": "object",
      "required": ["id", "name", "fps", "loop", "durationMs", "keyframes"],
      "properties": {
        "id": {
          "type": "string",
          "minLength": 1
        },
        "name": {
          "type": "string",
          "minLength": 1
        },
        "fps": {
          "type": "number",
          "exclusiveMinimum": 0
        },
        "loop": {
          "type": "boolean"
        },
        "durationMs": {
          "type": "number",
          "minimum": 0
        },
        "keyframes": {
          "type": "array",
          "items": {
            "$ref": "#/definitions/rigKeyframe"
          }
        }
      }
    }
  }
}
