{"anchors":[{"id":"hand","name":"hand","position":{"x":7,"y":8},"role":"custom"}],"animations":[{"events":[{"frameId":"frame_0","id":"event_true_0","name":"event_0","payload":{"inert":"globalThis.mustNotRun = true","value":0}},{"frameId":"frame_1","id":"event_true_1","name":"event_1","payload":{"inert":"globalThis.mustNotRun = true","value":1}},{"frameId":"frame_2","id":"event_true_2","name":"event_2","payload":{"inert":"globalThis.mustNotRun = true","value":2}}],"fps":60,"frameIds":["frame_0","frame_1","frame_2","frame_0"],"id":"loop","loop":true,"name":"same animation name"},{"events":[{"frameId":"frame_0","id":"event_false_0","name":"event_0","payload":{"inert":"globalThis.mustNotRun = true","value":0}},{"frameId":"frame_1","id":"event_false_1","name":"event_1","payload":{"inert":"globalThis.mustNotRun = true","value":1}},{"frameId":"frame_2","id":"event_false_2","name":"event_2","payload":{"inert":"globalThis.mustNotRun = true","value":2}}],"fps":60,"frameIds":["frame_0","frame_1","frame_2","frame_0"],"id":"once","loop":false,"name":"same animation name"}],"assetType":"character","canvasSize":{"height":537,"width":537},"colliders":[{"id":"body","name":"body","purpose":"body","rect":{"height":9,"width":8,"x":6,"y":7},"shape":"rect","visible":true}],"createdAt":"2026-10-02T05:27:46.547Z","displayName":"rich_engine","format":"chameleon-asset","frames":[{"durationMs":100,"id":"frame_0","layerStates":[{"layerId":"layer_0","visible":true},{"layerId":"layer_1","visible":false},{"layerId":"layer_2","visible":false}],"name":"same display name"},{"colliderOverrides":[{"colliderId":"body","rect":{"height":13,"width":12,"x":10,"y":11},"visible":false}],"durationMs":200,"id":"frame_1","layerStates":[{"layerId":"layer_0","visible":false},{"layerId":"layer_1","visible":true},{"layerId":"layer_2","visible":false}],"name":"same display name"},{"durationMs":300,"id":"frame_2","layerStates":[{"layerId":"layer_0","visible":false},{"layerId":"layer_1","visible":false},{"layerId":"layer_2","visible":true}],"name":"same display name"}],"gameAttributes":{},"id":"asset_a90e6969-a839-4f54-bbbb-57b433c97fa0_copy","layers":[{"id":"layer_0","layerType":"image","locked":false,"name":"main","opacity":1,"textureId":"texture_0","transform":{"position":{"x":0,"y":0},"rotation":0,"scale":{"x":1,"y":1}},"visible":true},{"id":"layer_1","layerType":"image","locked":false,"name":"main","opacity":1,"textureId":"texture_1","transform":{"position":{"x":0,"y":0},"rotation":0,"scale":{"x":1,"y":1}},"visible":false},{"id":"layer_2","layerType":"image","locked":false,"name":"main","opacity":1,"textureId":"texture_2","transform":{"position":{"x":0,"y":0},"rotation":0,"scale":{"x":1,"y":1}},"visible":false}],"name":"rich_engine","origin":{"x":4,"y":5},"parts":[],"tags":[],"textures":[{"id":"texture_0","kind":"edit","mimeType":"image/png","name":"texture_0","path":"textures/0.png","size":{"height":537,"width":537}},{"id":"texture_1","kind":"edit","mimeType":"image/png","name":"texture_1","path":"textures/1.png","size":{"height":537,"width":537}},{"id":"texture_2","kind":"edit","mimeType":"image/png","name":"texture_2","path":"textures/2.png","size":{"height":537,"width":537}}],"updatedAt":"2026-10-02T05:27:46.547Z","version":"0.2.0"}
