{
  "format": "chameleon-asset",
  "version": "0.2.0",
  "id": "asset_001",
  "assetType": "character",
  "name": "tomato_player",
  "displayName": "トマトプレイヤー",
  "canvasSize": { "width": 512, "height": 512 },
  "origin": { "x": 256, "y": 448 },
  "textures": [],
  "layers": [],
  "parts": [],
  "anchors": [],
  "colliders": [],
  "animations": [],
  "tags": ["player"],
  "gameAttributes": {},
  "createdAt": "2026-07-02T00:00:00.000Z",
  "updatedAt": "2026-07-02T00:00:00.000Z"
}
