{
  "format": "chameleon-asset",
  "version": "0.2.0",
  "id": "g19-unity-6000-3-21f1",
  "assetType": "character",
  "name": "g19_unity_6000_3_21f1",
  "displayName": "Group 19 Unity candidate fixture",
  "canvasSize": {
    "width": 20,
    "height": 20
  },
  "origin": {
    "x": 10,
    "y": 18
  },
  "textures": [
    {
      "id": "fixture-texture",
      "kind": "source",
      "name": "fixture-pages",
      "mimeType": "image/png",
      "size": {
        "width": 64,
        "height": 32
      },
      "path": "textures/main.png"
    }
  ],
  "layers": [
    {
      "id": "fixture-layer",
      "name": "fixture-layer",
      "layerType": "image",
      "visible": true,
      "locked": false,
      "opacity": 1,
      "transform": {
        "position": {
          "x": 0,
          "y": 0
        },
        "scale": {
          "x": 1,
          "y": 1
        },
        "rotation": 0
      },
      "textureId": "fixture-texture"
    }
  ],
  "parts": [],
  "anchors": [
    {
      "id": "anchor-center",
      "name": "center",
      "role": "center",
      "position": {
        "x": 10,
        "y": 10
      }
    }
  ],
  "colliders": [
    {
      "id": "collider-body",
      "name": "body",
      "purpose": "body",
      "shape": "rect",
      "visible": true,
      "rect": {
        "x": 2,
        "y": 3,
        "width": 12,
        "height": 14
      }
    },
    {
      "id": "collider-radius",
      "name": "radius",
      "purpose": "sensor",
      "shape": "circle",
      "visible": true,
      "circle": {
        "x": 10,
        "y": 10,
        "radius": 7
      }
    }
  ],
  "frames": [
    {
      "id": "fixture-a",
      "name": "fixture-a",
      "layerStates": [
        {
          "layerId": "fixture-layer"
        }
      ]
    },
    {
      "id": "fixture-b",
      "name": "fixture-b",
      "layerStates": [
        {
          "layerId": "fixture-layer"
        }
      ]
    }
  ],
  "animations": [
    {
      "id": "animation-cross-page",
      "name": "cross-page",
      "fps": 4,
      "loop": true,
      "frameIds": ["fixture-a", "fixture-b"]
    }
  ],
  "tags": ["group19", "engine-fixture", "unity", "candidate"],
  "gameAttributes": {},
  "createdAt": "2026-08-15T00:00:00.000Z",
  "updatedAt": "2026-08-15T00:00:00.000Z"
}
