{
  "format": "chameleon-asset",
  "version": "0.2.0",
  "id": "g17-engine-fixture",
  "assetType": "character",
  "name": "g17_engine_fixture",
  "displayName": "Group 17 Engine Fixture",
  "canvasSize": {
    "width": 64,
    "height": 64
  },
  "origin": {
    "x": 32,
    "y": 60
  },
  "textures": [
    {
      "id": "fixture-texture",
      "kind": "source",
      "name": "fixture-pages",
      "mimeType": "image/svg+xml",
      "size": {
        "width": 64,
        "height": 64
      },
      "path": "atlas/pages/page-000.svg"
    }
  ],
  "layers": [
    {
      "id": "fixture-layer",
      "name": "fixture-layer",
      "layerType": "image",
      "visible": true,
      "locked": false,
      "opacity": 1,
      "transform": {
        "position": {
          "x": 0,
          "y": 0
        },
        "scale": {
          "x": 1,
          "y": 1
        },
        "rotation": 0
      },
      "textureId": "fixture-texture"
    }
  ],
  "parts": [],
  "anchors": [
    {
      "id": "anchor-center",
      "name": "center",
      "role": "center",
      "position": {
        "x": 32,
        "y": 32
      }
    }
  ],
  "colliders": [
    {
      "id": "collider-body",
      "name": "body",
      "purpose": "body",
      "shape": "rect",
      "visible": true,
      "rect": {
        "x": 8,
        "y": 10,
        "width": 40,
        "height": 44
      }
    },
    {
      "id": "collider-radius",
      "name": "radius",
      "purpose": "sensor",
      "shape": "circle",
      "visible": true,
      "circle": {
        "x": 32,
        "y": 32,
        "radius": 22
      }
    }
  ],
  "frames": [
    {
      "id": "fixture-a",
      "name": "fixture-a",
      "layerStates": [
        {
          "layerId": "fixture-layer"
        }
      ]
    },
    {
      "id": "fixture-b",
      "name": "fixture-b",
      "layerStates": [
        {
          "layerId": "fixture-layer"
        }
      ]
    }
  ],
  "animations": [
    {
      "id": "animation-cross-page",
      "name": "cross-page",
      "fps": 4,
      "loop": true,
      "frameIds": ["fixture-a", "fixture-b"]
    }
  ],
  "tags": ["group17", "engine-fixture"],
  "gameAttributes": {},
  "createdAt": "2026-08-14T00:00:00.000Z",
  "updatedAt": "2026-08-14T00:00:00.000Z"
}
